{
  "meta": {
    "product": "重质纯碱（散装罐车/吨袋，送到厂价）",
    "company": "株洲旗滨集团股份有限公司（601636.SH）",
    "short_name": "旗滨集团",
    "company_type": "民营A股上市公司，控股股东福建旗滨集团，实控人俞其兵",
    "industry": "浮法/光伏玻璃制造",
    "use": "浮法/光伏玻璃熔窑配合料",
    "scenario": "替换现有供应商（先进合格供方名录、切现货，再拿长协份额）",
    "note": "skill 示范案例：纯碱→玻璃客户。判断逻辑与结果结构可复用到其他化工品。"
  },
  "company_profile": [
    {
      "dimension": "组织类型",
      "fact": "民营A股上市公司（601636.SH，2011年上市）；控股股东福建旗滨集团有限公司，实际控制人俞其兵；董事长张柏忠",
      "source": "https://static.cninfo.com.cn/finalpage/2026-04-23/1225157320.PDF",
      "source_title": "旗滨集团2025年年度报告摘要（巨潮资讯）",
      "confidence": "证据"
    },
    {
      "dimension": "规模",
      "fact": "24条优质浮法线16,600吨/日 + 9条光伏线10,600吨/日 + 4条电子玻璃线、2条药用玻璃线；浮法产能行业第二；员工超万人",
      "source": "https://static.cninfo.com.cn/finalpage/2025-04-25/1223283955.PDF",
      "source_title": "旗滨集团2024年年度报告",
      "confidence": "证据"
    },
    {
      "dimension": "基地分布",
      "fact": "湖南、浙江、广东、福建、云南、天津及马来西亚设有生产基地",
      "source": "https://jobcareer.sdu.edu.cn/eweb/jygl/index.so?modcode=jygl_zpxxck&subsyscode=zpfw&rklx=jyw&lmxhV=0402&type=ssoZxzpView&id=CgPBwp9Km7XTpnicNJT43h",
      "source_title": "天津旗滨节能玻璃有限公司招聘简介",
      "confidence": "证据"
    },
    {
      "dimension": "采购模式",
      "fact": "纯碱与主要纯碱厂家签订长协合同，长协比例逐年提升，价格由双方协商",
      "source": "https://www.nbd.com.cn/articles/2023-07-11/2911388.html",
      "source_title": "每经互动：旗滨集团纯碱长协采购",
      "confidence": "证据"
    },
    {
      "dimension": "采购组织",
      "fact": "基地采购岗JD明写“统筹工厂原材料、备品备件、辅料等采购……对接集团总部供应链，落地集采政策，完成年度降本目标”；另有事业部采购经理、基地采购员/采购工程师岗",
      "source": "https://www.liepin.com/job/1983587367.shtml",
      "source_title": "旗滨集团马来西亚物流采购主任JD（猎聘）",
      "confidence": "证据"
    },
    {
      "dimension": "技术权重",
      "fact": "2025年研发投入2.71亿元，提交专利申请73件、新获授权71项（发明15项），组建研究总院；有玻璃组成类发明专利",
      "source": "http://static.cninfo.com.cn/finalpage/2025-08-28/1224597273.PDF",
      "source_title": "旗滨集团2025年半年度报告",
      "confidence": "证据"
    },
    {
      "dimension": "成本地位",
      "fact": "纯碱约占玻璃原材料成本54%（原材料约占生产成本43%，燃料34%）",
      "source": "https://xincailiao.ofweek.com/news/2023-04/ART-180423-8420-30593741.html",
      "source_title": "中国平板玻璃市场成本结构分析",
      "confidence": "证据"
    },
    {
      "dimension": "单耗",
      "fact": "每吨玻璃约消耗0.2吨纯碱；旗滨自身2017-2019年单吨浮法玻璃对应218/206/207kg纯碱采购量",
      "source": "https://pdf.dfcfw.com/pdf/H3_AP202311031608297615_1.pdf",
      "source_title": "研报《纯碱和玻璃的周期属性探讨》",
      "confidence": "证据"
    },
    {
      "dimension": "需求量级",
      "fact": "集团年纯碱需求百万吨级；单条1200吨/日浮法线年需纯碱约8万吨、年采购额约1.2-2亿元",
      "source": "",
      "source_title": "由单耗0.2×日熔量×330天×单价1500-2500元/吨推算",
      "confidence": "估算"
    }
  ],
  "logic_chain": [
    {
      "step": 1,
      "from": "纯碱是大宗、同质化化工品，占玻璃原材料成本54%（证据）",
      "to": "一定是组织化集采，价格与保供驱动，不存在零散随意采购",
      "basis": "证据"
    },
    {
      "step": 2,
      "from": "基地采购JD写明“对接集团总部供应链，落地集采政策”（证据）；集团年采购额亿元级（估算）",
      "to": "拍板在集团供应链分管高层，基地是执行与信息接口",
      "basis": "证据+估算"
    },
    {
      "step": 3,
      "from": "长协比例逐年提升（证据）；湖北同行调研：长协保供70-80%，“只要检测符合标准，纯碱可随时更换”（证据）",
      "to": "新进入者抢不到“第一次采购”，现实路径是先进名录、切现货/补充采购，等窗口拿份额",
      "basis": "证据+经验推断"
    },
    {
      "step": 4,
      "from": "玻璃配料最怕批次波动（熔化缺陷是窑炉级事故）；入厂检验由质量部门把关是行业通行制度（行业资料佐证）",
      "to": "技术/化验室握有一票否决权，是准入守门员",
      "basis": "经验推断"
    },
    {
      "step": 5,
      "from": "民营上市、流程化程度高（证据）",
      "to": "实控人/高管对大宗成本必然过问，但冷启动直接找老板成功率极低；老板是助推器不是入口",
      "basis": "经验推断"
    },
    {
      "step": 6,
      "from": "纯碱供需宽松期玻璃厂随用随采、低价补库（沙河调研：跌到心理价以下才补库）（证据）",
      "to": "跌价周期是替换供应商、压价切入的最好窗口；另有长协到期、供应商事故、新产线点火三个窗口",
      "basis": "证据+经验推断"
    }
  ],
  "roles": [
    {
      "id": "A",
      "dept": "集团供应链中心·大宗原料采购",
      "title": "纯碱采购经理/总监",
      "duties": ["发起", "评估", "拍板"],
      "is_entry": true,
      "concerns": [
        "价格与定价机制：长协一月一议/月底定价、到厂价含运费",
        "保供安全：碱厂产能与运距、旺季不断货、不依赖单一货源",
        "供应商风险：环保限产、涨价违约的历史记录"
      ],
      "opener": "不讲“我便宜”，讲“我能当你的第二货源”——亮运距/产能/批次稳定性数据和同行窑上使用案例；目标是先进合格供方名录、接现货和补充采购",
      "questions": [
        "长协覆盖率多少、何时到期？",
        "名录准入流程：送样数量、现场审核、试用批量、周期？",
        "现货/招标的频率与结算方式？",
        "技术把关人是谁，可否引荐送样？"
      ],
      "basis": "长协与集采为证据（每经互动、招聘JD）；“第二货源”打法为经验推断",
      "public_contacts": [
        { "channel": "官网", "value": "https://www.kibing-glass.com" },
        { "channel": "投资者热线", "value": "0755-21613759（2026-04公告启用）" },
        { "channel": "总部地址", "value": "深圳市宝安区新桥街道丰达三路9号旗滨集团总部大厦" }
      ]
    },
    {
      "id": "B",
      "dept": "基地/事业部采购",
      "title": "采购主任、采购员",
      "duties": ["执行", "评估"],
      "is_entry": false,
      "concerns": [
        "到货及时率与补库速度",
        "卸货与交付顺畅度",
        "出问题时的响应速度（缺料他背锅）"
      ],
      "opener": "聊执行细节不聊战略——交付准点率、应急补货承诺（如48小时到货）",
      "questions": [
        "基地有没有现货采购授权、额度多大？",
        "入厂检验由谁签字？",
        "现有供应商最近一次交付异常是什么？（=切入缺口）"
      ],
      "basis": "岗位存在为证据（猎聘/智联JD）；“内线撬动集团”为经验推断"
    },
    {
      "id": "C",
      "dept": "技术部/化验室（质量部）",
      "title": "化验室主任、IQC、工艺工程师",
      "duties": ["评估", "否决"],
      "is_entry": false,
      "concerns": [
        "指标一致性：总碱量、氯化钠、铁、粒度、水分、堆密度（以该厂内控标准为准）",
        "批次稳定性与COA齐全度",
        "换碱是否引发熔化波动（气泡、结石等缺陷）"
      ],
      "opener": "只聊质量不聊价格——出示连续批次检测报告、同行使用记录，主动提出免费送样+小试+试用期",
      "questions": [
        "内控指标比国标严在哪几项？",
        "选样→小试→上窑验证的流程和周期？",
        "现有供应商的质量扣分项？"
      ],
      "basis": "质量部门管入厂检验为行业通行制度（通用行业资料佐证，非该企业内部文件）；旗滨研发体系庞大为证据；“一票否决”为经验推断"
    },
    {
      "id": "D",
      "dept": "生产/窑炉车间",
      "title": "车间主任、配料工段",
      "duties": ["发起", "否决"],
      "is_entry": false,
      "concerns": [
        "配合料稳定性（影响热工制度）",
        "结块、扬尘、水分（影响投料与现场环境）",
        "断料风险（窑炉不能停）"
      ],
      "opener": "“换供应商后前3个批次我跟产跟检”，给足安全感",
      "questions": [
        "库存天数（含在途）多少？",
        "包装形式偏好：散装罐车/吨袋？",
        "现用料的常见毛病？"
      ],
      "basis": "库存水平约1周-1个月有期货调研佐证；“跟产承诺”打法为经验推断"
    },
    {
      "id": "E",
      "dept": "仓储物流",
      "title": "仓储主管、物流专员",
      "duties": ["执行", "否决"],
      "is_entry": false,
      "concerns": [
        "到货预约与月度节奏",
        "散装车/吨袋的卸货效率",
        "雨季防潮、亏吨争议"
      ],
      "opener": "确认进厂车辆资质、卸货窗口、结算计量方式",
      "questions": [
        "月度到货计划怎么排？",
        "运费由买方还是卖方承担（影响报价口径）？"
      ],
      "basis": "经验推断（职责通用）"
    },
    {
      "id": "F",
      "dept": "财务/资金",
      "title": "财务经理、资金主管",
      "duties": ["评估", "否决"],
      "is_entry": false,
      "concerns": [
        "付款方式：现款/银承比例、账期",
        "价格联动条款（纯碱价格大起大落，一月一议是行业常态）",
        "对账开票合规"
      ],
      "opener": "主动给两套结算方案（现款价/承兑价），显得懂行",
      "questions": [
        "付款审批流程多长？",
        "能否接受承兑、贴息谁担？"
      ],
      "basis": "经验推断+行业调研佐证（月底定价模式）"
    },
    {
      "id": "G",
      "dept": "老板/实控人、集团分管副总",
      "title": "董事长、分管供应链副总裁",
      "duties": ["拍板"],
      "is_entry": false,
      "concerns": [
        "总成本与供应安全（不依赖单一碱厂）",
        "涨价周期的锁价能力",
        "与大型碱厂战略关系的对等性"
      ],
      "opener": "不首触。等采购层推进到名录/试用阶段后，借“高层互访/战略协议”由你的管理层对接，临门一脚用",
      "questions": [
        "拍板权限边界在哪一级？",
        "长协决策的时点是什么时候？"
      ],
      "basis": "民营上市治理结构为证据；打法为经验推断"
    }
  ],
  "entry": {
    "first": "集团供应链中心的大宗原料采购经理/总监（角色A）",
    "why": "他是名录准入流程的owner，有引入备选供应商的内在动力（压价+保供）；百万吨级体量决定了拍板者不接待陌生销售，采购是唯一“既管流程又欢迎新人”的角色",
    "second_path": "从基地采购（B）或车间（D）切入拿痛点情报（现供是谁、出过什么问题、长协何时到期），再引荐给集团采购（A）；技术（C）在采购首肯后同步送样。反模式：绕过采购直接找技术；冷启动堵老板；上来砸最低价"
  },
  "blocking_points": [
    {
      "point": "长协锁定大部分采购量，没有缺口进不去",
      "owner": "集团采购/拍板层",
      "nature": "证据（长协比例逐年提升+同行调研70-80%）",
      "workaround": "窗口：长协到期前1-2个月、现有碱厂限产/涨价违约、纯碱跌价周期客户主动压价换供"
    },
    {
      "point": "名录准入的样品检验与试用周期长",
      "owner": "技术部/化验室",
      "nature": "经验推断（1-3个月量级）",
      "workaround": "一次备齐三批次样+完整COA+同行使用案例，压缩往返次数"
    },
    {
      "point": "拜访的是基地、拍板在集团",
      "owner": "组织结构本身",
      "nature": "证据（JD“落地集采政策”）",
      "workaround": "基地只做情报与好感，正式推进必须上到集团采购"
    },
    {
      "point": "账期/现款条件谈不拢",
      "owner": "财务",
      "nature": "经验推断+调研佐证（月底定价常见）",
      "workaround": "双轨报价（现款价/承兑价）"
    },
    {
      "point": "运距与到厂价经济半径不匹配",
      "owner": "物流+采购",
      "nature": "经验推断（调研：铁运运费约120-130元/吨，运费敏感）",
      "workaround": "主打就近基地，逐个区域突破"
    },
    {
      "point": "试用期质量波动被拉黑",
      "owner": "化验室+车间",
      "nature": "经验推断",
      "workaround": "首单选普通建筑玻璃线试，不先碰超白/光伏线"
    }
  ],
  "variants": [
    {
      "customer_type": "沙河型中小民营玻璃厂",
      "change": "链条收缩为“老板+采购主管+车间主任/化验员”；老板亲自比价、随用随采",
      "first_entry": "采购主管或老板本人（经验推断）"
    },
    {
      "customer_type": "日用玻璃/器皿厂",
      "change": "技术权重下降但极怕结块杂质；单批量小频次高，贸易商渠道占比高",
      "first_entry": "采购部"
    },
    {
      "customer_type": "国企背景玻璃企业",
      "change": "增加招标平台与合规流程，决策周期更长",
      "first_entry": "采购部，但需先入库招标平台（经验推断）"
    }
  ],
  "evidence_list": [
    "纯碱长协采购模式、比例逐年提升（每经互动2022/2023）",
    "集团集采政策与基地执行定位（猎聘JD原文）",
    "24条浮法线16,600吨/日、光伏10,600吨/日，行业第二（2024年报）",
    "纯碱占玻璃原材料成本54%、单耗约0.2（行业分析与研报）",
    "研发投入2.71亿、专利71项（2025半年报）",
    "行业库存1周-1个月、长协70-80%、随用随采（期货产业调研）",
    "民营治理结构：实控人俞其兵（2025年报摘要）"
  ],
  "inference_list": [
    "集团年纯碱需求百万吨级、单线年采购额1.2-2亿元（估算式见企业画像）",
    "化验室一票否决与1-3个月准入周期（行业通行做法）",
    "各角色“先聊什么”话术与窗口策略（销售经验）",
    "老板不作首触、技术不绕过采购（销售经验）",
    "跌价周期是替换供应商的窗口（证据+推断混合）"
  ],
  "sources": [
    { "title": "旗滨集团：纯碱采购与主要碱厂签长协，价格双方协商", "url": "https://www.nbd.com.cn/articles/2023-07-11/2911388.html", "note": "采购模式核心证据" },
    { "title": "旗滨集团：纯碱长协比例逐年提升（2023-03）", "url": "https://www.nbd.com.cn/articles/2023-03-13/2707717.html" },
    { "title": "旗滨集团：纯碱长协比例逐年提升（2022-11）", "url": "https://www.nbd.com.cn/articles/2022-11-14/2550495.html" },
    { "title": "旗滨集团2024年年度报告（巨潮资讯）", "url": "https://static.cninfo.com.cn/finalpage/2025-04-25/1223283955.PDF", "note": "产能、行业地位" },
    { "title": "旗滨集团2025年半年度报告（巨潮资讯）", "url": "http://static.cninfo.com.cn/finalpage/2025-08-28/1224597273.PDF", "note": "研发投入与专利" },
    { "title": "旗滨集团2025年年度报告摘要（巨潮资讯）", "url": "https://static.cninfo.com.cn/finalpage/2026-04-23/1225157320.PDF", "note": "实控人与治理结构" },